{
  "schema": "character_engine.skeleton",
  "schema_version": "1.0",
  "asset": {
    "id": "human_adult_206",
    "name": "Human Skeleton",
    "version": "1.0.0",
    "units": "meters",
    "coordinate_system": "right-handed"
  },
  "skeleton": {
    "canonical_name": "HUMAN_SKELETON",
    "name": "Human Skeleton",
    "bones": [
      {
        "canonical_name": "FRONTAL",
        "name": "Frontal",
        "parent": "CRANIUM",
        "head": {
          "x": 0.0,
          "y": -0.0333,
          "z": 1.7666
        },
        "tail": {
          "x": 0.0,
          "y": -0.0333,
          "z": 1.8
        }
      },
      {
        "canonical_name": "PARIETAL_L",
        "name": "Parietal I",
        "parent": "CRANIUM",
        "head": {
          "x": 0.0533,
          "y": -0.0133,
          "z": 1.7331
        },
        "tail": {
          "x": 0.0533,
          "y": -0.0133,
          "z": 1.7666
        }
      },
      {
        "canonical_name": "PARIETAL_R",
        "name": "Parietal D",
        "parent": "CRANIUM",
        "head": {
          "x": -0.0533,
          "y": -0.0133,
          "z": 1.7331
        },
        "tail": {
          "x": -0.0533,
          "y": -0.0133,
          "z": 1.7666
        }
      },
      {
        "canonical_name": "TEMPORAL_L",
        "name": "Temporal I",
        "parent": "CRANIUM",
        "head": {
          "x": 0.0666,
          "y": -0.0666,
          "z": 1.6663
        },
        "tail": {
          "x": 0.0666,
          "y": -0.0666,
          "z": 1.7331
        }
      },
      {
        "canonical_name": "TEMPORAL_R",
        "name": "Temporal D",
        "parent": "CRANIUM",
        "head": {
          "x": -0.0666,
          "y": -0.0666,
          "z": 1.6663
        },
        "tail": {
          "x": -0.0666,
          "y": -0.0666,
          "z": 1.7331
        }
      },
      {
        "canonical_name": "OCCIPITAL",
        "name": "Occipital",
        "parent": "CRANIUM",
        "head": {
          "x": 0.0,
          "y": 0.0666,
          "z": 1.6329
        },
        "tail": {
          "x": 0.0,
          "y": 0.0666,
          "z": 1.6997
        }
      },
      {
        "canonical_name": "SPHENOID",
        "name": "Esfenoides",
        "parent": "CRANIUM",
        "head": {
          "x": 0.0,
          "y": -0.0333,
          "z": 1.5994
        },
        "tail": {
          "x": 0.0,
          "y": -0.0333,
          "z": 1.6329
        }
      },
      {
        "canonical_name": "ETHMOID",
        "name": "Etmoides",
        "parent": "CRANIUM",
        "head": {
          "x": 0.0,
          "y": -0.0533,
          "z": 1.6329
        },
        "tail": {
          "x": 0.0,
          "y": -0.0533,
          "z": 1.6663
        }
      },
      {
        "canonical_name": "MAXILLA_L",
        "name": "Maxilar I",
        "parent": "CRANIUM",
        "head": {
          "x": 0.04,
          "y": -0.0533,
          "z": 1.6128
        },
        "tail": {
          "x": 0.04,
          "y": -0.0533,
          "z": 1.6462
        }
      },
      {
        "canonical_name": "MAXILLA_R",
        "name": "Maxilar D",
        "parent": "CRANIUM",
        "head": {
          "x": -0.04,
          "y": -0.0533,
          "z": 1.6128
        },
        "tail": {
          "x": -0.04,
          "y": -0.0533,
          "z": 1.6462
        }
      },
      {
        "canonical_name": "ZYGOMATIC_L",
        "name": "Cigomatico I",
        "parent": "CRANIUM",
        "head": {
          "x": 0.0799,
          "y": -0.04,
          "z": 1.5994
        },
        "tail": {
          "x": 0.0799,
          "y": -0.04,
          "z": 1.6329
        }
      },
      {
        "canonical_name": "ZYGOMATIC_R",
        "name": "Cigomatico D",
        "parent": "CRANIUM",
        "head": {
          "x": -0.0799,
          "y": -0.04,
          "z": 1.5994
        },
        "tail": {
          "x": -0.0799,
          "y": -0.04,
          "z": 1.6329
        }
      },
      {
        "canonical_name": "NASAL_L",
        "name": "Nasal I",
        "parent": "CRANIUM",
        "head": {
          "x": 0.0133,
          "y": -0.0666,
          "z": 1.6997
        },
        "tail": {
          "x": 0.0133,
          "y": -0.0666,
          "z": 1.7198
        }
      },
      {
        "canonical_name": "NASAL_R",
        "name": "Nasal D",
        "parent": "CRANIUM",
        "head": {
          "x": -0.0133,
          "y": -0.0666,
          "z": 1.6997
        },
        "tail": {
          "x": -0.0133,
          "y": -0.0666,
          "z": 1.7198
        }
      },
      {
        "canonical_name": "LACRIMAL_L",
        "name": "Lagrimal I",
        "parent": "CRANIUM",
        "head": {
          "x": 0.0333,
          "y": -0.0533,
          "z": 1.6663
        },
        "tail": {
          "x": 0.0333,
          "y": -0.0533,
          "z": 1.6797
        }
      },
      {
        "canonical_name": "LACRIMAL_R",
        "name": "Lagrimal D",
        "parent": "CRANIUM",
        "head": {
          "x": -0.0333,
          "y": -0.0533,
          "z": 1.6663
        },
        "tail": {
          "x": -0.0333,
          "y": -0.0533,
          "z": 1.6797
        }
      },
      {
        "canonical_name": "PALATINE_L",
        "name": "Palatino I",
        "parent": "CRANIUM",
        "head": {
          "x": 0.0266,
          "y": -0.04,
          "z": 1.566
        },
        "tail": {
          "x": 0.0266,
          "y": -0.04,
          "z": 1.5861
        }
      },
      {
        "canonical_name": "PALATINE_R",
        "name": "Palatino D",
        "parent": "CRANIUM",
        "head": {
          "x": -0.0266,
          "y": -0.04,
          "z": 1.566
        },
        "tail": {
          "x": -0.0266,
          "y": -0.04,
          "z": 1.5861
        }
      },
      {
        "canonical_name": "INFERIOR_NASAL_CONCHA_L",
        "name": "Concha inf I",
        "parent": "CRANIUM",
        "head": {
          "x": 0.0333,
          "y": -0.0466,
          "z": 1.5994
        },
        "tail": {
          "x": 0.0333,
          "y": -0.0466,
          "z": 1.6128
        }
      },
      {
        "canonical_name": "INFERIOR_NASAL_CONCHA_R",
        "name": "Concha inf D",
        "parent": "CRANIUM",
        "head": {
          "x": -0.0333,
          "y": -0.0466,
          "z": 1.5994
        },
        "tail": {
          "x": -0.0333,
          "y": -0.0466,
          "z": 1.6128
        }
      },
      {
        "canonical_name": "VOMER",
        "name": "Vomer",
        "parent": "CRANIUM",
        "head": {
          "x": 0.0,
          "y": -0.0599,
          "z": 1.5994
        },
        "tail": {
          "x": 0.0,
          "y": -0.0599,
          "z": 1.6329
        }
      },
      {
        "canonical_name": "MANDIBLE",
        "name": "Mandibula",
        "parent": "CRANIUM",
        "head": {
          "x": 0.0,
          "y": 0.0,
          "z": 1.566
        },
        "tail": {
          "x": 0.0,
          "y": 0.0,
          "z": 1.5994
        }
      },
      {
        "canonical_name": "MALLEUS_L",
        "name": "Martillo I",
        "parent": "CRANIUM",
        "head": {
          "x": 0.0133,
          "y": -0.0133,
          "z": 1.6329
        },
        "tail": {
          "x": 0.0133,
          "y": -0.0133,
          "z": 1.6395
        }
      },
      {
        "canonical_name": "MALLEUS_R",
        "name": "Martillo D",
        "parent": "CRANIUM",
        "head": {
          "x": -0.0133,
          "y": -0.0133,
          "z": 1.6329
        },
        "tail": {
          "x": -0.0133,
          "y": -0.0133,
          "z": 1.6395
        }
      },
      {
        "canonical_name": "INCUS_L",
        "name": "Yunque I",
        "parent": "CRANIUM",
        "head": {
          "x": 0.0133,
          "y": -0.0133,
          "z": 1.6262
        },
        "tail": {
          "x": 0.0133,
          "y": -0.0133,
          "z": 1.6329
        }
      },
      {
        "canonical_name": "INCUS_R",
        "name": "Yunque D",
        "parent": "CRANIUM",
        "head": {
          "x": -0.0133,
          "y": -0.0133,
          "z": 1.6262
        },
        "tail": {
          "x": -0.0133,
          "y": -0.0133,
          "z": 1.6329
        }
      },
      {
        "canonical_name": "STAPES_L",
        "name": "Estribo I",
        "parent": "CRANIUM",
        "head": {
          "x": 0.0133,
          "y": -0.0133,
          "z": 1.6195
        },
        "tail": {
          "x": 0.0133,
          "y": -0.0133,
          "z": 1.6262
        }
      },
      {
        "canonical_name": "STAPES_R",
        "name": "Estribo D",
        "parent": "CRANIUM",
        "head": {
          "x": -0.0133,
          "y": -0.0133,
          "z": 1.6195
        },
        "tail": {
          "x": -0.0133,
          "y": -0.0133,
          "z": 1.6262
        }
      },
      {
        "canonical_name": "HYOID",
        "name": "Hioides",
        "parent": "CRANIUM",
        "head": {
          "x": 0.0,
          "y": -0.0533,
          "z": 1.5444
        },
        "tail": {
          "x": 0.0,
          "y": -0.0533,
          "z": 1.5473
        }
      },
      {
        "canonical_name": "CERVICAL_1",
        "name": "C1",
        "parent": "CRANIUM",
        "head": {
          "x": 0.0,
          "y": 0.0,
          "z": 1.5516
        },
        "tail": {
          "x": 0.0,
          "y": 0.0,
          "z": 1.5473
        }
      },
      {
        "canonical_name": "CERVICAL_2",
        "name": "C2",
        "parent": "CERVICAL_1",
        "head": {
          "x": 0.0,
          "y": 0.0,
          "z": 1.5473
        },
        "tail": {
          "x": 0.0,
          "y": 0.0,
          "z": 1.543
        }
      },
      {
        "canonical_name": "CERVICAL_3",
        "name": "C3",
        "parent": "CERVICAL_2",
        "head": {
          "x": 0.0,
          "y": 0.0,